{"$schema":"https://json-schema.org/draft/2020-12/schema","$id":"https://xhnovel.local/contracts/handoff-build-request.schema.json","type":"object","additionalProperties":false,"required":["schema_version","build_request_id","exploration_brief_artifact_id","research_lead_artifact_ids","source_declaration_artifact_id","execution_profile","requested_at","build_request_hash"],"properties":{"schema_version":{"$ref":"defs.schema.json#/$defs/schema_version"},"build_request_id":{"$ref":"phase0-defs.schema.json#/$defs/hbr_id"},"exploration_brief_artifact_id":{"$ref":"defs.schema.json#/$defs/artifact_id"},"research_lead_artifact_ids":{"type":"array","minItems":0,"uniqueItems":true,"items":{"$ref":"defs.schema.json#/$defs/artifact_id"}},"source_declaration_artifact_id":{"$ref":"defs.schema.json#/$defs/artifact_id"},"execution_profile":{"const":"DIRECT_FULL_WORK_V1"},"requested_at":{"$ref":"defs.schema.json#/$defs/iso_datetime"},"build_request_hash":{"$ref":"defs.schema.json#/$defs/sha256"}}}
