{
  "build_request_hash": "sha256:4ca5a67b77ff47e1957030b41b5544027441b1864b4f2c58fe2889df3d9a0a1e",
  "build_request_id": "HBR-B40CAFEE1F184437BF19",
  "execution_profile": "DIRECT_FULL_WORK_V1",
  "exploration_brief_artifact_id": "sha256:6591a8aa66718be73da06f43dd76cb1b79d8eda922ab4283a90d6c05236c755e",
  "requested_at": "2026-09-03T01:57:00Z",
  "research_lead_artifact_ids": [
    "sha256:43f6d54d569abbbf20260fffd2cbf4211f122f6d5848f1fc295c99fb76e0b377",
    "sha256:4c77ddde03b09ea75dbfa1c21efa1eb6ad63030a8ae120f314678f84a339d226",
    "sha256:ba33d34f2ac629206630760fd638d6d1756e4efbe9184bc4ef2342ca050ad186"
  ],
  "schema_version": "0.2-draft",
  "source_declaration_artifact_id": "sha256:81a0b1e10c5340432df7de3ca75f0dd3bd2c27966f83c69c9ea56281bb7aa27c"
}
